outcome_id,outcome_description,outcome_type,typical_timeline_months,financial_implications,appeal_possible,enforcement_mechanism,precedent_cases,embedding_text
OUT_095,Forgery Conviction - Document Declared Void,Favorable,24,Forged document declared void; imprisonment; fine; property restored,Yes,Jail authority; Registration cancellation,Sunil Clifford Daniel v. State of Punjab 2012; Hiralal v. State of Haryana 2009,Forgery conviction document void IPC 465 property restored
OUT_096,Rape Case - Acquittal,Unfavorable,24,Accused free; victim may appeal; psychological harm,Yes,None,Tukaram v. State of Maharashtra 1978 (controversial); Mahmood Farooqui v. State (NCT Delhi) 2017,Rape acquittal accused free evidence insufficient victim harm
OUT_097,Debt Recovery Tribunal - Recovery Certificate Issued,Favorable,18,Recovery certificate enables attachment of debtor's assets; bank recovers dues,Yes,DRT; Police assistance,Bank of India v. Abhijit Industries 2000; ICICI Bank v. Grapco Industries 2001,DRT recovery certificate bank loan default attachment execution
OUT_098,Out of Court Settlement,Favorable,3,Mutually agreed terms; full or partial payment; no further litigation,No,Contractual enforcement,Various cases - negotiated resolutions,Settlement agreement out of court negotiation payment terms
OUT_099,Case Transferred to Different Court,Neutral,6,No final outcome; case continues in new court,No,None,Various transfer petitions,Transfer petition case different court jurisdiction change
OUT_100,Proceedings Stayed by Higher Court,Neutral,6,Lower court proceedings halted; parties wait; no final outcome pending,No,Higher court monitoring,Various stay orders,Stay granted proceedings suspended higher court intervention
